<?xml version="1.0" encoding="UTF-8"?>
<Production xmlns="http://www.dei.isep.ipp.pt/tap-2021" xmlns:xsi="http://www.w3.org/2001/XMLSchema-instance" xsi:schemaLocation="http://www.dei.isep.ipp.pt/tap-2021 ../../production.xsd ">
  <PhysicalResources>
    <Physical id="PRS_1" type="PRST 1"/>
    <Physical id="PRS_2" type="PRST 1"/>
  </PhysicalResources>
  <Tasks>
    <Task id="TSK_1" time="100">
      <PhysicalResource type="PRST 1"/>
      <PhysicalResource type="PRST 1"/>
      <PhysicalResource type="PRST 1"/>
    </Task>
  </Tasks>    
  <HumanResources>
    <Human id="HRS_1" name="Antonio">
      <Handles type="PRST 1"/>
    </Human>
    <Human id="HRS_2" name="Maria">
      <Handles type="PRST 1"/>
    </Human>
    <Human id="HRS_3" name="Manuel">
      <Handles type="PRST 1"/>
    </Human>
  </HumanResources>
  <Products>
    <Product id="PRD_1" name="Product 1">
      <Process tskref="TSK_1"/>
    </Product>
  </Products>
  <Orders>
  	<Order id="ORD_1" prdref="PRD_1" quantity="1"/>
  </Orders>
</Production>